{
  "building": {
    "scalar_heat_load": 1.0,
    "scalar_electrical_load": 1.0,
    "fabric_intervention_index": 0
  },
  "data_centre": {
    "maximum_load": 50.0,
    "hotroom_temp": 43.0
  },
  "domestic_hot_water": {
    "cylinder_volume": 2500.0
  },
  "electric_vehicles": {
    "flexible_load_ratio": 0.5,
    "small_chargers": 0,
    "fast_chargers": 3,
    "rapid_chargers": 0,
    "ultra_chargers": 0,
    "scalar_electrical_load": 3.0
  },


  "energy_storage_system": {
    "capacity": 800.0,
    "charge_power": 300.0,
    "discharge_power": 300.0,
    "battery_mode": "CONSUME",
    "initial_charge": 0.0
  },
"grid": {
    "export_headroom": 0.0,
    "grid_export": 100.0,
    "grid_import": 140.0,
    "import_headroom": 0.4,
    "min_power_factor": 0.95,
    "tariff_index": 0
  },
  "heat_pump": {
    "heat_power": 70.0,
    "heat_source": "AMBIENT_AIR",
    "send_temp": 70.0
  },
  "mop": {
    "maximum_load": 300.0
  },
  "renewables": {
    "yield_scalars": [ 500 ]
  },
  "config": {
    "capex_limit": 2500000.0
  }
}
